"Project","Text"
"P096481","priority topics include preparation framework future municipal investment borrowing independent intermediary view participation commercial banks streamlining donor financing approaches onlending including possibilities establish revolving fund"
"P096481","procedures designed ensure funds intended purposes project operations manual"
"P096481","procedures relating onlending provision grants municipalities defined detail project operations manual pom"
"P096481","procurement municipal services improvement project carried accordance world banks guidelines procurement ibrd loans ida credits dated revised october procurement guidelines guidelines selection employment consultants world bank borrowers dated revised october consultant guidelines provisions stipulated financing agreement fa"
"P096481","procurement implementationand arrangements"
"P096481","procurement procurement services consulting services supply installation include bulbs street lights metering equipment water network office equipment pmu services related municipal investments performance investment grants international competitive bidding icb estimated cost amount equivalent procured internationalcompetitive bidding"
"P096481","procurement project procured include reconstruction construction water supply sewerage networks rehabilitation buildings replace windows thermo insulation related municipal investments performance investment grants international competitive bidding icb estimated cost amount equivalent procured international competitive bidding"
"P096481","procurement plan"
"P096481","procurement risk assessment"
"P096481","procurement roles procedures detailed annex elaborated pom"
"P096481","procurement staff municipality cse representatives involved subproject implementation evaluation committees technical staff involved project procurement trained bank procurement guidelines procedures"
"P096481","program assistant ecssd ahmed eiweida peer reviewer sr"
"P096481","programs projects executed receiving positive opinion approval eia study ministry environment physical planning"
"P096481","project components"
"P096481","project concept note june"
"P096481","project coordinating committee interministerial committee set project effectiveness including representatives central agencies oversight municipal infrastructure sector ministries finance local government transport communication environment physical planning"
"P096481","project coordinating committee interministerial committee set project effectiveness date central agencies oversight municipal infrastructure sector ministries finance local government transport communication environment physical planning"
"P096481","project description"
"P096481","project description ref pad ii technical annex component municipal investments provide subloans municipalities investments irevenuegenerating public services ii investment projects priority municipalities cost saving potential"
"P096481","project development objective key indicators"
"P096481","project financial statements euros"
"P096481","project management services assist project implementation municipalities cses provide guidance support local project entities ensure bank fiduciary procurement financial management safeguard guidelines environment socialland acquisition observed"
"P096481","project managementoriented interim unaudited financial reports ifrs project monitoring supervision"
"P096481","project monitoring include performance indicators participating utilities international benchmarking network methodology ibnet"
"P096481","project preparation benefits collaboration multilateral bilateral agencies active fyr macedonia eu kfw gtz usaid"
"P096481","project procurement include"
"P096481","proposals local infrastructure investment including cses submitted municipality"
"P096481","proposed subprojects represent technically feasible leastcost approach address specific"
"P096481","provider awareness"
"P096481","public disclosure regular benchmarking cse performance efficiency improve cse employee performance enterprise operations increase efficiency raise payment collection decrease costs losses"
"P096481","publicprivate partnerships"
"P096481","quarterly ifrs submitted bank exercise control spending banks fms perform site supervision"
"P096481","rationale bank involvement"
"P096481","reasonableness plans budgets include estimates verified pmu subloans grants municipalities difficult estimate actual expenditures municipalities level"
"P096481","recurrent expenses expected funded internally cost recovery"
"P096481","rejection bids bids rejected procurement process started prior bank concurrence price adjustment contracts duration months price adjustment clause"
"P096481","report mk project appraisal document proposed amount euro"
"P096481","reporting monitoring"
"P096481","republic macedonia strategy action plan reform communal services enterprises focus water sewerage solid waste management diagnostic strategy report economic consulting associates association mcic bar ige consulting october component papers strategy action plan communal services enterprises survey report quantitative qualitative october ii strategy action plan communal services enterprises financial issues institutional aspects decentralisation communal sector paper october iii paper legal institutional framework communal activities macedonia february iv affordability willingness pay support mechanisms water sewerage solid waste management macedonia lilit melikyan september annex statement loans credits yugoslav republic macedonia municipal services improvement project difference expected actual original amount millions disbursements project id fy purpose ibrd ida sf gef cancel"
"P096481","requests proposals rfps short lists terms conditions contracts evaluation reports recommendations awarding contracts equivalentfirst contracts equivalent individual contracts individual contracts equivalent sss contracts subject bank prior review"
"P096481","respondents referred municipalities political influence cse operation primarily regard tariff setting cse staffing"
"P096481","risk budget entities"
"P096481","roof insulation proposed"
"P096481","rural development specialist ecssd environmental safeguards plamen stoyanov kirov procurement specialist ecsps richard"
"P096481","sa audits municipalities requested additional assurance"
"P096481","safeguard policies safeguard policies triggered project environmental assessment opbp"
"P096481","qualify investment funding component municipalities received positive opinion borrowing"
"P096481","securities bid security performance security follow accepted practice local market"
"P096481","annex borrowing preconditions municipalities based public debt law ministry finance guidelines"
"P096481","annex preconditions municipalities borrow based public debt law ministry finance guidelines"
"P096481","selection based consultants qualifications cq procedures consulting assignments amount equivalent"
"P096481","selection consultants consultants services contracts procured project include detailed design supervision financial audit feasibility environmental studies strengthening capacity municipalities cses ta"
"P096481","selection fixed budget fbs assignments accordance paragraph consultants guidelines"
"P096481","selections reviewed bank"
"P096481","separate denar accounts treasury municipality beneficiary loadgrant"
"P096481","service providers accountable consumers political considerations frequently drive decisionmaking sound business principles consumer responsiveness economic efficiency"
"P096481","service providers accountability consumers decisionmaking driven political considerations principles sound business management consumerresponsiveness economic efficiency"
"P096481","key study recommendations adopted municipalitycselevel reflected conditions proposed performance grants"
"P096481","projects prepared date involve renovation upgrading focus cost savings revenue generation"
"P096481","shopping amount equivalent procuredthrough shopping"
"P096481","shopping shopping procedures contracts amount"
"P096481","significant nonstandard conditions ref pad iii"
"P096481","assessment government considerable progress setting modern procurement function"
"P096481","reported unemployment rate declined remains south eastern europe excluding kosovo"
"P096481","single account tsa behalf government entity level"
"P096481","single source selection sss subject banks prior approval selection consultants specialized contracts meet requirements sss consultants guidelines"
"P096481","social protection ecshd specialist aniruddha dasgupta peer reviewer adviser mdw patricia annez peer reviewer urban advisor feu bank funds expended date project preparation"
"P096481","social scientist sdv zarko bogoev operations officer ecssd yarissa lyngdoh sommer consultant ecssd lisa fonick haworth sr"
"P096481","sole source selection subject banks prior approval hiring current staff individual consultants meet requirements paragraph consultants guidelines"
"P096481","municipalities inherited debts previous administrations prior decentralization unable assume borrowings"
"P096481","percent respondents earn mkd month increased tariffs essential services water sewerage solid waste removal considerable burden"
"P096481","percent respondents supported idea providing welfare recipients om free water month"
"P096481","subprojects require temporary access land possibly land acquisition"
"P096481","specific procurement notices spn published icb procurement consulting contracts guidelines bidding documents rfps ready"
"P096481","specifically percent surveyed households afford percent tariff increase water supply wastewater percent tariff increase supported percent households"
"P096481","specifically carry procurement subprojects behalf municipalities participation stages procurement process"
"P096481","staff experience budget preparation"
"P096481","staffing appointed staff core functions"
"P096481","audit institution low"
"P096481","strategic context rationale"
"P096481","structural introduced municipalities cses ready improve service delivery customers reduce direct indirect negative impacts citizens national local taxpayers"
"P096481","structure ecowmy al agpiarb indurq manufacturing smes hausehol ha exlnjmsc oewrai guvr final pexpenditure imports goaos rmd emces ma"
"P096481","subprojects expected revenuegenerating costsaving investments"
"P096481","subprojects include water sanitation services finance civil equipment consulting services rehabilitate water sanitation services including source consumption metering leak detection repair network rehabilitation optimization pressure zoning equipment operations urgent rehabilitation repair selected sewers sewer maintenance equipment pipe replacement ii solid waste management finance collection infrastructure support equipment collection bins support vehicles related equipment consulting services limited extent civil equipment upgrade existing disposal sites meet minimum sanitary standards iii revenuegenerating costsaving investments finance civil equipment related consulting services upgrading andor expanding services facilities responsibility municipalities public lighting storm water drainage systems urban transport systems green markets insulation public buildings lower energy consumption enhance efficiency"
"P096481","subprojects demonstrate revenue earning cost savings qualify"
"P096481","subprojects financed subloans component grants component cy meet subproject eligibility conditions outlined annex"
"P096481","subprojects qualify category rating op ineligible financing project"
"P096481","successive governments macedonia pursuing economic reforms successfully preserved macroeconomic stability"
"P096481","collaboration continue support government efforts streamline procedures donor investments municipal activities"
"P096481","investments rarely yield rate return tariff environments economic environmental social benefits investments improve services reduce costs"
"P096481","projects yield financial rates return generate additional demand revenues focus increased efficiencies improvements service performance"
"P096481","sufficient municipal government ownership signaled willingness borrow component choose participate component implementation challenging reforms"
"P096481","supervision plan"
"P096481","supervision performed bankaccredited financial management specialist"
"P096481","support institutional strengthening zels million improve water supply municipality ebrd municipal environment million fy water supply improvement action program national finance municipalities kfw water sewerage million fy ensure sustainable affordable programme supply drinking water selected municipalities"
"P096481","support national policy strategy"
"P096481","sustainability"
"P096481","suto municipalities"
"P096481","annex economic financial analysis yugoslav republic macedonia municipal services improvement project"
"P096481","eligible participation msip municipalities approved phase decentralization condition"
"P096481","ta component limited prospective participants component le municipalities cses receive subloans expected receive preparatory technical assistance grants municipalities allocated served basis permitted total allocation component"
"P096481","table summarizes financial management assessment risk ratings project table risks risk risk risk mitigation measures risk rating rating ajier miiigati measur es"
"P096481","table subproject implementationroles responsibilities function municipality cse pmu mof pcc propose subprojects local council proposes municipality approves prepare subprojects technical support technical support designs technical projectfunded projectfunded specifications bidding consultants consultants documents appraise subprojects select subloan terms funding approval mof pdd positive opinion finalizes subloan borrowing performance municipality grant agreements terms municipalities loan grace repayment periods procurement participates carries procurement activities procurement pmu subprojects responsibility behalf municipal municipalities representative signs stages contracts participation suppliers manages assures quality stages procurement post review wb percent contracts financial management submits disbursement pmu verifies requests pmu completion makes payment documentation suppliers receipt forwards treasury funds mof payment oversees fm procedures manages project designated account makes payments denar accounts participating municipalities supervise contract subprojects subprojects makes periodic implementation direct municipal cse services random checks acceptance responsibility"
"P096481","table summary risk assessment description risk ratinga mitigation measures ratingaof risk residual risk municipalities lack experience project procurement handled capacity handle procurement pmu municipalities participation"
"P096481","takeup investment loans low due municipalities moderate inadequate creditworthiness municipalities receiving approvals borrow leading low participation slow disbursements carehlly monitored implementation"
"P096481","technical analysis expected identify compare potential alternatives taking account critical considerations environmental requirement land availability quality material longterm operational costs"
"P096481","process underway significant challenges remain improve public procurement legislation supplementary regulations rules procedures standard bidding documents procurement capacity building control public procurement complaints mechanism interaction institutions"
"P096481","process underway significant challenges remain improve public procurement legislation supplementary regulations rules procedures standard bidding documents procurement capacity building control public procurement complaints mechanism interaction institutions"
"P096481","adoption eu aquis created common obligation sectors administration carry activities set national program accordance eu aquis requirements"
"P096481","agreement publicly cse municipality mail cse customers minimum customer rights cse responsibilities"
"P096481","agreement cse service covered minimum service quality measures cse planning budgeting reporting auditing requirements financial technical performance targets governance structure municipality tariff calculation methodology annual review procedure customer complaint appeals procedures public monitoring accountability mechanisms"
"P096481","annual audited project financial statements audit report provided bank months fiscal project closing"
"P096481","annual audited project financial statements audit report provided bank months fiscal"
"P096481","annual cost project audits covered project funds"
"P096481","audits conducted accordance international standards auditing isa issued terms reference acceptable bank"
"P096481","august country fiduciary assessment cfa stated procurement risk significant substantial progress public procurement legislation"
"P096481","awarded grant amount individual municipality percent investment subloan"
"P096481","bank government considered establishing municipal development funding arrangement longerterm vehicle selection appraisal implementation subprojects channeling funding msip potentially sources donors"
"P096481","bank agreed due complex project design reliable transparent timely information edusoft software project accounting reporting supplement treasury reports"
"P096481","bank sharing government international experiences alternative municipal infrastructure financing structures study define arrangement fyr macedonia included proposed project component"
"P096481","bank considerable experience balkans supporting preparation implementation municipal services transition economies shifting responsibilities municipalities experience newly decentralized countries transfer funds responsibilities framework encourages local accountability promoting national oversight policy developments"
"P096481","bank provided locallevel assistance community development project cdpa social fund communitybased operations completed"
"P096481","bank continuing dialogue issues outlined ppiaffwnded reform strategy discussed"
"P096481","bank continuing dialogue government subsidy reforms ensure poor households afford minimum service levels water wastewater solid waste management"
"P096481","bank review process borrower"
"P096481","bank supervision team conduct regular environmental safeguard supervision missions purpose supervision team include environmental safeguard specialist oversee implementation sitespecific emps"
"P096481","bank supervision team monitor implementation progress evaluate outcomes semi annual annual basis pmuprepared report information"
"P096481","bank team carry prior review supervision post reviews percent contracts subject post review"
"P096481","basic preconditions municipal borrowing accordance provisions law financing local governments"
"P096481","borrower bank project team agree plan negotiations plan implementing agencys project database bank external website"
"P096481","borrower proceed procurement signing la reimbursed retroactively selection procurement procedures including advertising accordance bank consultant guidelines procurement guidelines"
"P096481","borrower proceed procurement signing loan agreement la reimbursed retroactively"
"P096481","borrower ensure measures carrying environmental assessment management framework eamf land acquisition resettlement policy framework larpf timely manner"
"P096481","borrower ensure loan proceeds finance activities expected generate significant adverse longlasting irreversible environmental effects"
"P096481","borrower ensure subprojects component project selected appraised implemented evaluated procedures acceptable bank subloan grant provided participating municipalities terms conditions satisfactory bank outlined loan agreement schedule section"
"P096481","borrower ensure subprojects component project selected appraised implemented evaluated procedures acceptable bank subloan grant provided participating municipalities terms conditions satisfactory bank outlined loan agreement"
"P096481","borrower macedonia represented ministry finance"
"P096481","ceiling designated account defined disbursement letter project amounts million"
"P096481","central bank continued tighten monetary policy curb credit growth steadily increased rates june introduced additional reserve requirements banks annual credit growth percent"
"P096481","challenge municipalities achieve costrecovery reducing costs increased efficiency raising revenues tariff increases improved bill collection attaining service standards required european union directives"
"P096481","committee chaired ministry finance include national professional associations zels adkom"
"P096481","committee comprise ministry representatives provide forum informationsharing advising project management"
"P096481","committee meet quarterly receive summaries project progress reports prepared"
"P096481","committee provide forum information sharing advice project management"
"P096481","committees main responsibilities ensure communications government stakeholders project objectives rules implementation progress advise sectoral interministerial issues affect projectfunded activities water sanitation policies investments reinforce transparency selection municipalities subprojects"
"P096481","committees main responsibilities ensure interagency communications project objectives rules implementation progress advise sectoral interministerial issues affect projectfunded activities pertaining water sanitation policies investments reinforce transparency selection municipalities subprojects"
"P096481","communications strategy aim assure level transparency access information feedback mechanisms stakeholders"
"P096481","component finance incremental operating costs incurred responsibility project management reports ministry finance"
"P096481","component finance staff incremental operating costs incurred pmu responsible project management reports ministry finance"
"P096481","comprehensive relevant laws policies governmental decisions instructions standards eamf"
"P096481","controls procedures applied draft financial manual"
"P096481","cost consultants monitoring evaluation included funding"
"P096481","country fiduciary assessment cfa prepared august assessed procurement risk significant"
"P096481","country impressive progress past steadily recovering economic political social fallout ethnic conflict"
"P096481","country partnership strategy macedonia reportno targets pillars world bank assistance fostering economic growth creation increasing living standards improving governance transparency public service delivery support market economy"
"P096481","cse operation lacks autonomy efficiency roles cses municipalities separated consumercitizen voice weak"
"P096481","cse established separate cost accounts service provided activity undertaken enable calculation unit costs product service"
"P096481","cse apply cost accounting software comparable software implemented gtz support ten municipalities"
"P096481","cse feasible nonrevenue water reduction program reduce nonrevenue water provide evidence source meter step implementing nonrevenue water program"
"P096481","cse completed inventory assets owned andor cse"
"P096481","data source municipalities endofyear financial report submitted ministry finance"
"P096481","deliberate material violation suppliers contractors contractors provision amount obstructive practice"
"P096481","department environment national authority responsible eia presently administration environment ae body organizational responsibility ministry environment physical planning moepp"
"P096481","designated account managed operated mof"
"P096481","diagnostic strategy report includes proposals sectoral institutional strategies preliminary action plan reform key stakeholders represented steering committee chaired ministry finance"
"P096481","director access required additional skills project implementation ensure timely reporting monitoring evaluation"
"P096481","director ensure timely reporting monitoring evaluation"
"P096481","draft diagnostic strategy study included proposals sectoral institutional strategies preliminary action plan reform including water tariff subsidy policies key stakeholders represented steering committee chaired ministry finance included representatives ministries labor social policy transport communications local selfgovernment environment physical planning representative bodiesthe association municipal communal enterprises adkom national association local governments zels"
"P096481","lists generic issues considered preparing sitespecific eaeia emps type subproject activity financed project"
"P096481","eamf separate environmental mitigation plans environmental monitoring plans emps developed type subproject"
"P096481","eamf overview legal framework environmental localself government sectors macedonia procedures environmental assessment project development required national legislation procedures environmental assessment project development world bank procedures analysis potential environmental impacts caused subprojects implementation project activities"
"P096481","eamf lists potential negative environmental impacts type project activity environmental mitigation monitoring activities mitigate neutralise impacts"
"P096481","eamf overview fyr macedonia legal framework environment local selfgovernment procedures environmental assessment project development required national legislation procedures environmental assessment project development world bank procedures analysis potential environmental impacts caused subprojects implementation project activities"
"P096481","eamf disclosed october prior appraisal"
