"Project","Text"
"P079032","percentage private companies managing communal sector facilities basis concession agreements agreements total communal entities"
"P079032","percentage private investments total amount investments upgrade communal infrastructure"
"P079032","percentage wornout assets communal infrastructure internet portal includes percentage regions connected portal monitoring project system monitoring hcs outcome performance regional level information practice hcs including regulations methodologies guidelines operational"
"P079032","percentage consumers served cs providers governmentowned joint stock companies strengthening private operators"
"P079032","percentage multifamily buildings maintenance current capital repair carried private maintenance entities"
"P079032","percentage multifamily buildings owners common equity ownership land plot building located"
"P079032","percentage payments residents communal services channeled billing collection centers directly cs provider buildinglevel collective management structures"
"P079032","petersburg economic transformation multisector reforms development loan investments selected cultural sites critical million citys future development international approved cultural destination supporting fiscal federation regional fiscal fiscal federation regional reform competitively selected regions fiscal reform project closed rewarding grants implementing million approved transformation municipal housing markets housing project marketeconomy principles stimulation million municipal land development commercially approved closed financed private housing infrastructure accelerating sustainable divestiture enterprise enterprise housing divestiture housing russia demonstrating project million participating cities combination housing approved closed reforms investments designed transfer housing private sector lower operating cost annex results framework monitoring federation housing communal services project results framework pdo project outcome indicators project outcome information"
"P079032","planning budgeting budgeting basis procurement plan approved rosstroi finance staff excel"
"P079032","refer annex details procurement arrangements"
"P079032","refer annex details process municipalities selection annex details responsibilities parties project"
"P079032","po treasury devt"
"P079032","poland karelia la saint petersburg insu pen di kolyma pskov petrozavodsk yr ange tay irka novgorod arkhangelsk che naryan mar rskiy belarus ran kolmya yamal ga ge wland smolensk pen lo palana tver vologda gyda kh siberian moscow yaroslavl kotlas vorkuta pen"
"P079032","policy exceptions readiness"
"P079032","poorly managed hcs providers affected negatively compete efficient public private companies"
"P079032","poverty social impact analysis reform housing communal services sector"
"P079032","poverty headcount rates cut half regional disparities declined"
"P079032","power supply hcs facilities"
"P079032","power transmission lines overhead cables"
"P079032","practice reforms housing"
"P079032","preparation design documents responsibility participating municipalities"
"P079032","preparing investment plans guidelines preparing technical designs reporting rosstroi progress reform program"
"P079032","debtgdp"
"P079032","debtlexports"
"P079032","private financing infancy due investment risk profit potential lack solid legal regulatory framework widespread political interference"
"P079032","private financing infancy"
"P079032","private financing infancy rapid increases private investment sector"
"P079032","private management companies represent percent housing management maintenance market"
"P079032","privatized tenantowners perceive hold joint ownership common property feel responsible management maintenance repair"
"P079032","procurement arrangements considered project found adequate satisfactory bank"
"P079032","procurement arrangements project found adequate satisfactory bank"
"P079032","procurement centralized experienced quality investments financed selected assist execution project operation"
"P079032","procurement methods thresholds icb ncb shisw consultants shism firms individ"
"P079032","procurement performed framework municipal investment plans"
"P079032","procurement plan months project preparation reviewed approved bank negotiations"
"P079032","procurement plan procurement plan subnational component covers percent project cost elaborated municipalities beneficiaries funds selected"
"P079032","procurement undertaken banks procurement guidelines"
"P079032","production costs sold unit communal services percentage tariff"
"P079032","program social economic development russian federation mediumterm outlook"
"P079032","program pure investment focus program investmentonly focus ruled due lack reform processes sustainability investment spending lessons learned section"
"P079032","proiect implementation period expected effectiveness date july expected closing date november annual disbursement plan table estimated disbursements million fy fylo nll fy annual"
"P079032","project audit audit scope regular project audits fer auditors expanded include detailed review internal acceptable bank"
"P079032","project components issues highlighted annex addressed project components support hcs reform implementation federal level support implementation hcs reforms subnational level preparation implementation hcs investment plans project management monitoring table timing components subcomponents"
"P079032","project description"
"P079032","project description pad technicalannex project support governments hcs program ten competitively selected medium sized cities combination technical assistance reforms investments infrastructure components component support hcs reform implementation federal level including developing legal regulatory framework federal level ii setting national hcs monitoring system iiidisseminating project results nonparticipating municipalities regions"
"P079032","project development objective indicators"
"P079032","project development objective pad technical annex project development objective improve quality financial viability hcs participating municipalities"
"P079032","project interim unaudited financial reports ifrs project monitoring supervision"
"P079032","project management"
"P079032","proposed investments lead sustainable medium longterm environmental benefits due increased energy efficiency reduced emissions atmosphere water bodies"
"P079032","public awareness campaign reforms selected regions million subcomponent consists implementation regional public awareness education campaigns inform consumers objectives rationale reforms reasons tariff increases benefits approaches collective management multi apartment buildings common properties commercial provision hcs services"
"P079032","public spending supports incompetent municipal unitary enterprises provide incentives efficiency"
"P079032","pumping stations"
"P079032","pumping stations"
"P079032","qcbs qbs fbs lcs sbcq sss circumstances"
"P079032","quality communal services declined assets deteriorating"
"P079032","quality delivery communal services population improved percentage population rating services satisfactory"
"P079032","quality delivery communal services including district heating water supply hot water supply waste water disposal improved"
"P079032","requirements meeting environmental safeguards environmental chapter subproject proposal incorporated bidding documents"
"P079032","ratio formally granted allowances benefits paid allowances benefits"
"P079032","ratio tariffs residents tariffs consumer"
"P079032","rationale bank involvement"
"P079032","rayon diesel gas diesel power stations mw capacities excluding constructions"
"P079032","reasons cited include lines lack availability documents redtape"
"P079032","receive review project reports seek clarifications issues instructions actions"
"P079032","recent ongoing analytical forms integral broader poverty dialogue government russia"
"P079032","recognizing uncertainty lack specific investment proposals stage project development developed green red list typical investments housing communal sector"
"P079032","recognizing uncertainty lack specific investment proposals stage project development emp developed green red typical investments housing communal sector"
"P079032","reform achieving results reauire improving efficiency investment hcs sector"
"P079032","reform processes require management professional technical skills deal organizational emerge reform cultural issues involved"
"P079032","reform processes require shift skills"
"P079032","reforming upgrading housing utilities sector russian federation subprogram federal targeted housing program housing zhilische"
"P079032","reforms investments expected positively affect levels government reducing subsidies hcs providers efficiency gains improved financial condition private companies improving access lines business housing management maintenance households improving service quality"
"P079032","rehabilitation modernization technical conditions converting consumeroriented policy providing metering mechanisms consumer control supply building level"
"P079032","relations regions municipalities service providers actors local level including municipal administrations communal services providers home owner associations buildinglevel management structures cooperate implement reforms investments project"
"P079032","relevance investments investment subprojects relevant achieving broad improvements hcs services"
"P079032","relevance investments investment subprojects relevant achieving wide ranging improvements hcs services"
"P079032","relevant psia activities include extensive analytical regular consultations local government civil society donors involved dialogue transition"
"P079032","renewable energy sources"
"P079032","replicabilitv implemented reforms investments"
"P079032","report ru project appraisal document proposed loan amount million russian federation housing communal services project january sustainable development department russia country unit europe central asia region document restricted distribution recipients performance official duties"
"P079032","review approve projects operations manual"
"P079032","review proposals extending project implementation period reducing reallocating loan funds"
"P079032","rf president putin government russia recently declared accessible housing national priority proaams"
"P079032","rosstroi investment program implementation agreements municipalities successfully implemented reform program prepared satisfactory investment plans"
"P079032","rosstroi mof subsequently investment program implementation agreements municipalities successfully implemented reform program prepared satisfactory investment plans"
"P079032","rosstroi staff required regularly monitor compliance contractors clients project noncompliance undertake actions mitigate situation"
"P079032","rosstroi conduct periodic spot checks"
"P079032","rosstroi estimates percent hcs assets deteriorated percent"
"P079032","rosstroi project related issues director administrative issues"
"P079032","rosstroi knowledge russian federation legislation familiar world bank safeguards policies implementation municipal heating municipal water wastewater projects"
"P079032","rosstroi independent engineering firms routine supervision quality investment phase"
"P079032","rosstroi serve primary agency coordination reporting bank"
"P079032","rosstroi charge project implementation"
"P079032","rosstroi responsible monitoring evaluation project"
"P079032","rosstroi establish evaluation committee procurement legislation include representatives ministry finance ministry economic development trade"
"P079032","rosstroi framework agreements selected reserve municipalities start reform phase formalize responsibilities municipalities project"
"P079032","rosstrois supervision"
"P079032","rur fiscal january december abbreviations acronyms cas country assistance strategy cfaa country financial accountability assessment cpar country procurement assessment report cs communal services emp environmental management plan eia environmental impact assessment fer foundation enterprise restructuring financial institutions development gdp gross domestic product gor government russia grp gross regional product hcs housing communal services hoa home owners association imf international monetary fund iwg interagency ldp letter development policy mrd ministry regional development moedt ministry economic development trade mof ministry finance mue municipal unitary enterprise nobus national survey households welfare social programs participation pdo project development objectives public expenditure review ppl public procurement law psia poverty social impact analysis rosstroi federal agency construction hcs ta technical assistance wto world trade organization vice president shigeo katsu ecavp country manageddirector klaus rohland eccu sector director peter thomson ecssd sector manager wael zakout ecssd task team leader gevorg sargsyan ecssd russian federation housing communal services project contents page"
"P079032","russia prepaid debt imf paid debt paris club"
"P079032","russia succeeded reducing public sector foreigncurrency denominated debt percent gdp percent gdp"
"P079032","russian federation housing communal services project project appraisal europe asia ecssd date january team leader gevorg sargsyan country director klaus rohland sectors subnational government sector director peter"
"P079032","russian federation statement ifcs held disbursed portfolio millions dollars committed disbursed ifc ifc fy approval company loan equity quasi partic"
"P079032","russian federation"
"P079032","safeguard policies safeguard policies triggered project environmental assessment opbp"
"P079032","samara len en krasnodar volgograd ufa yekaterinburg maykop al stavropol sii eor dzhug chelyabinsk tyumen ye cherkessk elista orenburg gora elbrus bo lain ppla kurgan sey nalchikastrakhan ra angara vladikavkaz nazran ur groznyy omsk georgia tomsk makhachkala krasnoyarsk yuzhno novosibirsk kemerovo sea sakhalinsk azerbaijan novokuznetsk lake ian barnaul blagoveshchensk khabarovsk abakan baikal birobidzhan ust ordynskiy sp chita ta ca uzbekistan irkutsk ulan ude li gorno aginskoye kyzyl otea altaysk russ sikh feder china vladivostok sea oblast centers japan mongolia national capital"
"P079032","savings derived lower losses benefit utility quantified measuring total financial costs output lower volume service produced serve consumption lower operating costs occur"
"P079032","project municipalities assessment includes rigorous process assessment investment plans evaluation investment plans focuses quality relevance reform results result investments"
"P079032","social protection consumers strengthened ensure affordability services"
"P079032","describes key steps reform phase select cities reform phase assess investment plans award grants cities completed planned reform"
"P079032","social protection consumers strengthened ensure affordability services"
"P079032","implementing bank financed projects implementation arrangements organizational structure adequate"
"P079032","selected indicators regular monitoring impact households monitoring adequacy funding housing allowances adequacy program administration"
"P079032","selected municipalities required submit investment plans improve hcs"
"P079032","selection consultants procurement plan identify consulting assignments applicable methods selection consultants"
"P079032","set national monitoring system million subcomponent support set monitoring system federal government monitor status hcs sector regions municipalities aggregate data country wide progress reforms"
"P079032","aspects bank engagement benefit complex process hcs reform packaging capacity enhancement policy advice integrated coherent multisectoral package supports quality decision iiits track record infrastructure housing social policies iii banks sustained relationships matches term nature reforms"
"P079032","sewage pumping stations"
"P079032","sewer pipes"
"P079032","shelter water supply sewerage heating hot water services basic services citizens countries rate"
"P079032","shelter water supply sewerage heating hot water services basic services citizens countries rate"
"P079032","short lists consultants services estimated cost equivalent contract composed national consultants accordance provisions paragraph consultant guidelines"
"P079032","shortages heating supply regions winter shown challenge maintaining continuous reliable supply hcs services"
"P079032","desire switch report based disbursement initial stage project implementation budgeting system incorporated accounting system"
"P079032","build heating water supply pipelines laid public rights"
"P079032","federal funds allocated regions social expenditure cofinancing fund"
"P079032","cs providers losses services provided households lack incentives improve service quality expand service coverage"
"P079032","mid government policy phase lgoti privileges replace meanstested social payments"
"P079032","social impacts closely monitored life project"
"P079032","social payment arrears eliminated targeted programs hcs municipalities"
"P079032","space heating systems residential buildings facilities constructions"
"P079032","specific responsibilities project management include"
"P079032","specifically interagency"
"P079032","specifically detailed description guidelines quantification economic financial benefits costs"
"P079032","specifically key municipal responsibilities include implementing reforms reform plan ta federal government"
"P079032","step competitive selection cities reform phase selection participating cities nationwide contest"
"P079032","step reform status evaluation process selection cities investment phase selected cities participate investment phase program"
"P079032","step technical economic financial environmental assessment investment projects months reform phase selected reserve municipality submit investment plan outlining subprojects financed investment phase"
"P079032","mechanisms restructuring project accordance evolving circumstances client demands"
"P079032","strategic context rationale"
"P079032","strengthening social protection consumers technical assistance support improving targeting coverage efficiency hcs subsidies enhance impact social assistance programs poverty alleviation"
"P079032","strengthening social protection consumers technical assistance support improving targeting coverage efficiency hcs subsidies enhance impact social assistance programs poverty alleviation"
"P079032","strengthening social protection consumers poor adequately protected rising tariffs inadequate targeting funding social assistance programs subsidies paid victimizes consumers adversely affects financial viability cs providers compensated subsidizing household tariffs administration targeted social assistance benefits fragmented limits effectiveness housing allowances"
"P079032","strengthening social protection hcs consumers poor adeauatelv protected rising tariffs"
"P079032","strengths significant strengths provide basis reliance project financial management system include ithe experience financial management staff implementing bankfinanced projects satisfying bank financial management requirements iithe unqualified audit reports issued projects financial statements absence issues raised auditors management letters iiisound internal control system piu"
"P079032","subnational lending subnational lending alternative sovereign lending ruled allowed conducting countrywide competitive selection municipalities sufficient leverage facilitate comprehensive reforms hcs"
"P079032","substantial related poverty social impacts policy program carried hcs sector reform program russia decade"
"P079032","subsurface water intake facilities"
"P079032","review relates quality audits midterm review approximately hcs providers continuing commencement investment phase monitoring compliance audits financial statements prepared eligibility criteria accordance local accounting standards hcs providers carried accordance local auditing standards local demonstrated adequate capacity quality independence"
"P079032","agencies pius advantage skilled consultants reliable suitable standalone computerized information systems"
"P079032","impacts include permanent temporary withdrawal additional land sites cutting vegetation air pollution wastewater discharges polluted storm water runoff construction period generation construction wastes negative impacts physical factors including increased noise levels potential exposure workers asbestos materials"
"P079032","investment plans municipality reviewed separately agreed borrower bank included procurement plan project"
"P079032","investment plans implemented municipalities demonstrated reforms hcs sector expected happen months beginning project implementation"
"P079032","procurement plans include contracts procurement methods icb shoppinglsmall banks standard bidding documents icb national standard bidding documents agreed satisfactory bank"
"P079032","supervision reform phase concentrate monitoring reforms stages project concentrate efficient implementation investment plans including fiduciary safeguards aspects"
"P079032","supervision hcs project focus impact outcomes program stakeholder support feasible options realizing intended development goals"
"P079032","supervision implementation municipal investment plans million subcomponent consist team experts supervise implementation municipal investment plans investment phase project"
"P079032","supervisionplan"
"P079032","surface water intake facilities volume day"
"P079032","surplus revenues stabilization fund"
"P079032","sustainability sustainabilitv implemented reforms investments"
"P079032","system rehabilitation modernization reduce costs improve service quality increase consumerorientation metering consumer control supply"
"P079032","system rehabilitation introduction modern technology considerably reduce cost improve quality service delivery"
"P079032","regulation reviewed account investment costs"
"P079032","project development objective improve quality financial viability hcs participating municipalities"
"P079032","component results component support competitive selection participating municipalities implementation hcs reforms select reform minded municipalities subnational level lack participate project"
"P079032","mitigate impacts framework environmental management plan emp developed borrower"
"P079032","table summarizes financial management assessment risk ratings project risk rating risk risk risk mitigation measures rating mitigation measures inherent risk country level"
"P079032","table criteria assess reform status improving legal acts adopted regulatory agencies set tariffs communal services minimum period financial viability compulsory annual indexation inflation fuel cost providers approval municipalities regions cs providers production programs investment programs minimum period identification sources funding"
"P079032","table list eligible investments"
"P079032","table minimum criteria participation contest rn cost recovery level housing communal services percent collection rate hcs payments percent ratio local budget current expenditures local budget revenues ratio local budget deficit local budget revenues federal regional financial assistance percent ratio municipal debt local budget revenues financial assistance governments percent ratio municipalitys debt service local budget expenditures percent municipality region overdue debt federal budget loans guarantees ratio regional budget current expenditures regional budget revenues percent ratio regional budget deficit regional budget revenues federal financial assistance percent ratio regional public debt regional budget revenues financial assistance governments percent ratio regions public debt service regional budget expenditures percent criteria table assessing reform status selection process focus main improving financial viability communal services providers assessment criteria focus breaking vicious cycle revenues bad services improving cost recovery ii reducing existing arrears governments service providers iii linking collection payments directly services provided iv service providers autonomous accountable strengthening social protection consumers assessment criteria focus improving targeting coverage efficiency hcs subsidies ensuring payment subsidies cash paid ii consolidation program administration targeted social assistance benefits including housing allowances creating market competition housing management maintenance assessment criteria focus improving management maintenance repair multifamily buildings iencouraging buildinglevel collective management structures ii creating market competition building maintenance current capital repair iii fostering tenantowner awareness rights responsibilities iv clarifying rights obligations land plots"
"P079032","tangible positive results providing adequate investments service mprovements participating cities"
"P079032","tariff crosssubsidies result distortions undermine financial sustainability cs providers"
"P079032","tariffs based standard calculation operating costs standard margin capital investment profit"
"P079032","tariffs set cs providers receive adequate financial resources operate efficiently"
"P079032","technical assistance focuses encouraging buildinglevel collective management structures ii creating market competition building maintenance current capital repair iii fostering tenantowner awareness rights responsibilities iv clarifying rights obligations land plots"
