"Project","Text"
"P092218","bank principal liaison government effective translating highlevel government support active decisionmaking operational level"
"P092218","bank undertaking review ppp program identify additional technical assistance"
"P092218","bank retains standard remedies agreement government event bank funds found abused smi iiff"
"P092218","bank team monitor analysis iiff performance subprojects project supervision"
"P092218","bank retain loan agreement conduct post reviews contracts"
"P092218","bank continue coordinate ausaid partners key issues nbfi sector development"
"P092218","bank finance investment assured iiff adequate capacity ensuring subprojects carried accordance essf om compliant bank policies ifcs ps"
"P092218","bank review tor audit"
"P092218","bank government cochairs stakeholder developed project coordinates grantfunded activities financed donors"
"P092218","banking sectors capital adequacy ratio car february"
"P092218","banks eap safeguards secretariat review final essf om approval basis acceptability om bank"
"P092218","banks funds provided indonesia onlent iiff smi subordinated debt"
"P092218","banks lending ifcs investment instruments"
"P092218","banks lending instrument project financial intermediary loan fil"
"P092218","banks loan prepared team supervised task managed"
"P092218","banks loan expected disbursed fouryear period fy ifcs equity investment expected annex"
"P092218","banks loan goi subsidiary loan agreements subordinated debt equity ratio contractually ensure sufficient equity capital provided iiff shareholdersi"
"P092218","banks loan effective iiff management hired social environmental unit established"
"P092218","banks ongoing analytical improving environment infrastructure ppps capacity building ppp line agencies support project"
"P092218","banks role expected contribution"
"P092218","base projects irr cost ifcs equity"
"P092218","board directors responsible day day management company board commissioners responsible providing oversight function"
"P092218","borrower iiff established continue carry consultations disclosure activities essf updated"
"P092218","borrower requested ibrd variablespread loan denominated dollars final maturity including grace period"
"P092218","borrower provide funds iiff sole participating financial intermediary smi vehicle established government channel equity investments loans iiff"
"P092218","borrower provide funds iiff sole participating financial intermediary smi"
"P092218","boundaries colors denominations indonesia information shown map imply selected cities towns judgment province capitals legal status territory endorsement national capital acceptance indonesia boundaries"
"P092218","broad organization structure envisaged iiff basis positioning product offerings figure broad organization structure iiff kigurc"
"P092218","capacity local banks provide longterm financing limited"
"P092218","capacity bapepamlk strengthened ongoing program assistance ausaid funding significant portion iiffs project preparation costs"
"P092218","capacity financial sector provide longterm local currency financing projects offer competitivelypriced infrastructure services developed"
"P092218","ceiling advance account fixed million"
"P092218","central bank law amended bank indonesia bi independent government"
"P092218","challenge iiff convert set potential projects pipeline projects eligible iiff financing"
"P092218","consolidation democracy reelection reformist government sufficient strength press forward reform mandate term encouraging"
"P092218","consultations disclosure carried date considered iiff established result management team adopt disclose essf iiffs framework"
"P092218","country entered ongoing global financial crisis strong position"
"P092218","cps explicitly identifies private sector development infrastructure thematic form core bank engagement indonesia proposed project key component banks cps complements bank lending nonlending activities significantly improve infrastructure provision strengthen financial sector"
"P092218","creation financial institution iiff logical extension date"
"P092218","critical importance choice ceo flexibility adapt changing circumstances capacity wellselected board steer institution stand lessons learned creation financial institutions past"
"P092218","current account surplus usd bn bubble oil prices half inflated indonesias fuel import bill net income deficit oil producers transferred profits abroad"
"P092218","current draft essf builds adbapproved safeguards planning document outlines types subproject investments stages iiff invest subprojects prepared subprojects ready bidding subprojects implementation feebased advisory services requirements comply policies apply subprojects supported iiff implementation arrangements screening plan preparation consultation disclosure monitoring organizational structure iiff staffing ensure requirements implemented successfully subprojects meet applicable requirements world bank indonesian laws regulations"
"P092218","current global financial crisis credit crunch respects support launch iiff"
"P092218","decision support iiff driven government views key national institution facilitate longterm financing commercially viable infrastructure projects"
"P092218","decline investment dramatic energy sector resulting widespread blackouts load shedding"
"P092218","detailed design iiffs organization structure policies related human resources developed funding consultants ausaid"
"P092218","development partners involved establishment iiff highly committed success taking steps government management team iiff committed sustainable operation"
"P092218","difference rate banks lending rate indonesia effectively represents premium charged government taking exchange rate risk"
"P092218","draft essf continue updated satisfaction bank included integral om"
"P092218","dramatic decline oil prices falls commodity prices drove decline"
"P092218","economic analysis subprojects attempt quantify costs benefits measure net contribution subprojects society"
"P092218","economic internal rate return eirr economic net enpv estimated lifecycle costs benefits society project scenarios"
"P092218","environmental social policies adopted essf discussed key project stakeholders including ifc bank adb borrower directorate assets borrowers shareholder smi"
"P092218","equity investors developing approach efforts smi discussion government"
"P092218","establishment iiff requires regulatory framework resolution outstanding legal issues addressed uslooooo adb grant"
"P092218","establishment iiff closely linked program infrastructure reform actions supported banks idpl series"
"P092218","facility supports national subnational ppp projects including tollroads ferry terminals bulk water supply systems railways airport telecommunications project"
"P092218","government agreed significant minority equity stake invited development partners support iiff committed establishment iiff policy pronouncements idpls ambitious mandate iiff"
"P092218","final version essf acceptable bank basis environmental social sections om"
"P092218","financial management risks mitigated provision technical assistance establishment smi iiff ongoing donor funding continued smis iiffs resources ii provision technical assistance iiff recruitment qualified staff ifc provided grant financing retention executive search firm headhunt initial team expected ifc adb deg nominate iiff board commissioners iiithe provision technical assistance develop draft financial management section operations manual prepared submitted bank"
"P092218","financial sector indonesia regulated separate entities bi countrys central bank independent government responsible supervision regulation deposittaking financial institutions le banks authorized money changers bapepamlk responsible supervision nonbank institutions capital markets pension funds insurance venture capital multifinanceileasing companies"
"P092218","conditions effectiveness subsidiary loan agreement acceptable bank duly executed delivered behalf borrower smi effective binding parties accordance respective terms subject effectiveness loan agreement subordinated loan agreement acceptable bank duly executed delivered behalf smi iiff effective binding parties accordance respective terms subject effectiveness loan agreement iiff legally incorporated pursuant borrowers laws regulations articles association iiff executed founding shareholders approved mlhr borrower mof issued business license iiff cofinancing agreement adb loan agreement executed delivered conditions precedent effectiveness borrower withdrawals effectiveness agreement fulfilled shareholders agreement related share subscription documents entered founding shareholders andor iiff founding shareholders executed delivered behalf parties effective binding parties accordance respective terms project agreement duly executed delivered behalf smi iiff effective binding smi iiff accordance respective terms operations manual including essf acceptable borrower bank adopted iiff founding shareholder subscribed paid respective initial capital contribution amount required shareholders agreement smi disbursed financing amount idr billion equivalent usd million amount initial equity contribution smi required shareholders agreement iiff appointed employed chief executive officer chief financial officer environment social safeguards staff acceptable borrower bank"
"P092218","expected conditions effectiveness subsidiary loan agreement acceptable bank duly executed delivered behalf borrower smi effective binding parties accordance respective terms subject effectiveness loan agreement subordinated loan agreement acceptable bank duly executed delivered behalf smi iiff effective binding parties accordance respective terms subject effectiveness loan agreement iiff legally incorporated pursuant borrowers laws regulations articles association iiff executed founding shareholders approved mlhr borrower mof issued business license iiff cofinancing agreement adb loan agreement executed delivered conditions precedent effectiveness borrower withdrawals effectiveness agreement fulfilled shareholders agreement related share subscription documents entered founding shareholders andor iiff founding shareholders executed delivered behalf parties effective binding parties accordance respective terms project agreement duly executed delivered behalf smi iiff effective binding smi iiff accordance respective terms operations manual including essf acceptable borrower bank adopted iiff founding shareholder subscribed paid respective initial capital contribution amount required shareholders agreement smi disbursed financing amount idr billion equivalent usd million amount initial equity contribution smi required shareholders agreement iiff appointed employed chief executive officer chief financial officer environment social safeguards staff acceptable borrower bank"
"P092218","risks addressed ensure project objectives achieved identified risk mitigation measures"
"P092218","feasibility study project files"
"P092218","fund finances land acquisitions tollroads reimbursed concessionaire land acquisition completed"
"P092218","fund accessed tollroad concessionaires commenced construction tollroad section operational"
"P092218","requested bank support efforts establish iiff indonesias finance minister closely monitored progress"
"P092218","government recorded financing surplus percent gdp due lowerthanexpecteddeficit frontloaded borrowing strategy"
"P092218","government raised idea establishing infrastructure financing institution shortly coming office"
"P092218","government funds scheme capped idr trillion"
"P092218","government allocated initial capital commitment idr trillion smi national budget approved parliament"
"P092218","government developed landcapping scheme concessionaires pay land costs initially envisaged government pay remaining land acquisition costs"
"P092218","government established pt"
"P092218","government established publiclyowned holding company pt"
"P092218","government recently demonstrated willingness difficult decisions ensure sound governance financial sector"
"P092218","government repeatedly ensure operational independence iiff strong presence institutions bank involved greatly process"
"P092218","government requested bank support efforts establishing iiff development priorities povertyreduction agenda release key constraint countrys economy growth inadequate infrastructure"
"P092218","government requested bank support efforts establish iiff"
"P092218","government set ambitious targets increasing infrastructure investment reduce constraints growth continues develop framework private financing infrastructure risks appropriately shifted private sector recognizing economic financial efficiencies generated"
"P092218","government series steps including arranging billion contingent facility world bank adb japan australia"
"P092218","government contacting private investors domestic international positive preliminary indications providing equity investments obtained"
"P092218","government drafting fiveyear plan estimates require infrastructure investments worth roughly gdp approx"
"P092218","government pursuing ppp transactions infrastructure sectors including tollroads power plants natural gas pipelines railways ports bulk water plants airports telecommunications projects"
"P092218","government putting specific regulations governing activities infrastructure financing institutions iiff regulated supervised"
"P092218","government advanced establishment iiff obtained parliamentary approval invest idrl trillion infrastructure financing institutions"
"P092218","government intends terminate transactions move financial close accessing landcapping funds"
"P092218","government taking measures address land acquisition issues blocked private tollroad development"
"P092218","government recognizes local currency financing public sector riskmitigation mechanism"
"P092218","government values banks continued leadership ongoing engagement iiff ensure success"
"P092218","government banking corporate sectors reduced balance sheet vulnerabilities"
"P092218","governments foreign localcurrency bond ratings upgraded notch ba indonesias foreigncurrency bond ceiling upgraded ba ba"
"P092218","governments infrastructure program addresses challenges facing public private infrastructure investment bank supported progress significant elements governments reform program idpl series"
"P092218","gross nonperforming loan npl ratio february december"
"P092218","growth nbfi sector significant potential demand structured longterm investment alternatives nbfis liabilities typically longterm minimize maturity mismatches investments longterm assets"
"P092218","ifc equity investment coled denis clarke cinut arun sharma cgftg includes mathias hedinger cgfp marina feldman clefm robin sandenburgh cesi yoshiko saito gcmsm"
"P092218","ifc team drawn lessons experience bottlenecks infrastructure provision markets establishing greenfield financial institutions"
"P092218","ifc team guided georgina baker director cgf adam sack country manager indonesia management teams infrastructure financial markets dedartments"
"P092218","ifcs experience relevant establishment key iiff parameters terms management framework operational procedures environmental social standards enforcement standards integrity transparency management potential conflicts"
"P092218","ifcs infrastructure sector indonesia focused advisory notably power sector create goodquality contractual structures format awarding concessions"
"P092218","ifis including ifc retain minimum shareholding iiffs operations provide measure stability ownership level remain assist iiff operations"
"P092218","ifls mobilized substantial amounts grants project development effort"
"P092218","iiff aims draw initiatives apply focused policy advice project finance expertise commercialdrive advantages access attractive longterm finance raise private investment infrastructure times current levels"
"P092218","iiff fits firmly ifcs infrastructure dept cin strategy indonesia"
"P092218","iiff forms development priorities government aimed supporting growth poverty reduction addressing key constraint countrys economy growth inadequate infrastructure"
"P092218","iiff established time assessment"
"P092218","iiff financial institution complements existing financial sector time unique partnership government multi bilateral donorsinvestors private sector managed privately run commercial lines independence accountability"
"P092218","iiff line ifcs global financial markets cgf departments strategic objectives"
"P092218","iiff integral comprehensive government strategy accelerate investment infrastructure indonesia establishes enhances middleincome country mic status"
"P092218","iiff expected achieve objective building capacity skills providing longterm financing innovative financial products advisory services"
"P092218","iiff expected contribute ongoing policy reform initiatives play role project development establish national repository skills experience relating ppp projects create funding opportunities investor classes"
"P092218","iiff intended expected lead increased infrastructure investment delivery infrastructure services mediumlong term"
"P092218","iiff projected leverage total capital million raise billion domestic internationalcapital markets"
"P092218","iiff governments response lack longterm financing infrastructure projects"
"P092218","iiff create bankable infrastructure projects reach financial close offering advisory services relating policy reform project preparation transaction bidding structures"
"P092218","iiff address key weaknesses indonesias financial sector complement role existing financial institutions"
"P092218","iiff adopt corporate governance practices confirm position credible institution eyes stakeholders"
"P092218","iiff commercially oriented private sector governance mandated equipped mobilize local currency private financing tenor terms price development creditworthy infrastructure projects indonesia balance sheet structure credit rating borrow private debt market institutional investors lending funds individual projects terms private commercially funded infrastructure projects preferably cofinancing basis mobilizing sources financing providing financial products enhance credit individual infrastructure projects mobilize additional financing projects providing advisory services assisting creation bankable infrastructure projects policy support"
"P092218","iiff established board approval staffing final operations manual prior project effectiveness"
"P092218","iiff established board approval staffing final operations manual prior project effectiveness"
"P092218","iiff established nonbank financial institution provide variety financial products services support commercially viable infrastructure subprojects"
"P092218","iiff established approval development partners equity loan commitments obtained"
"P092218","iiff regulated bapepamlk broad framework regulation nonbank finance companies"
"P092218","iiff benefit longterm debt provided government loans provided bank adb"
"P092218","iiff build momentum generated result actions"
"P092218","iiff catalyze private investor commercially viable infrastructure projects national local level addressing ithe shortage specialized project finance infrastructure expertise ii design quality infrastructure concessions iiiensuring availability longterm debt offering additional sources equity"
"P092429","covenants bea maintain financial management system acceptable bank"
"P092429","development agencies imf support implementation sdds macroeconomic data improvement quarterly national accounts gfs bop"
"P092429","munilateral"
"P092429","include inew information processing analysis solutions developed tested iithe subsystems unified readymade software components standard industrial interfaces iii subsystems based solutions increased functionality application organizational levels statistical observation utilization midlevel specialists iv basis collective cis users irrespective geographic location tested tools creation maintenance databases economists developed tested accepted vi technology efficient warehousing processing microdata aggregated statistical data developed vii rosstats web site upgraded providing level openness tools searching statistical information users"
"P092429","participation conferences workshops project subject matter banks prior agreement procured solesource basis"
"P092429","partnership arrangements nia"
"P092429","payments designated account cover eligible expenditures project"
"P092429","refer annex details procurement arrangements"
"P092429","poland karelia la saint petersburg insu pen di kolyma pskov petrozavodsk yr ange tay irka novgorod arkhangelsk che naryan mar rskiy belarus ran kolmya yamal ga ge wland smolensk pen lo palana tver vologda gyda kh siberian moscow yaroslavl kotlas vorkuta pen"
"P092429","policy exceptions readiness"
"P092429","unacceptable features invalidated adding annex schedule mandatory provisions procurement bankfinanced contracts subject national competitive bidding loan agreement assure conducted procedures acceptable bank"
"P092429","debtgdp"
"P092429","prior postreview contracts procurement plan public education training research institutions services modernization statistics methodology component enhancement social statistics component human resource development training component banks prior agreement procured public education training research institutions including dependent institutions services development modern design technology statistical data collection processing dissemination component satisfactorily established suitably qualified private sector consultant readily assignment"
"P092429","prior postreview contracts procurement plan"
"P092429","privata principal repayments mf"
"P092429","procurement activities carried bureau economic analysis foundation bea selected piu"
"P092429","procurement proposed project carried accordance world banks guidelines procurement ibrd loans ida credits dated guidelines selection employment consultants world bank borrowers dated provisions stipulated legal agreement"
"P092429","procurement procured project include information technology equipment hardware software telecommunications equipment office equipment related technical services"
"P092429","procurement plan"
"P092429","program assistant decdg robert schware lead informatics specialist citpo lucas ojiambo sr"
"P092429","program objective phases nia"
"P092429","progress hampered improve techniques evaluate income distributions measure socioeconomic differentiation major population region income components"
"P092429","progress date"
"P092429","project component modernization economic statistics methodology"
"P092429","project component development modern design technology statistical data collection processing dissemination system"
"P092429","project component enhancement social statistics"
"P092429","project component human resource development"
"P092429","project component project management"
"P092429","project components"
"P092429","project description"
"P092429","project description onesentence summary component ref pad technical annex modernization statistics methodology component ensure development system national accounts harmonized international standards including introduction internationally compatible classifications development institutional sectors accounts satellite accounts"
"P092429","project development objective key indicators"
"P092429","project development objective ref pad technicalannex main objective project build sustainable statistical system timely coherent trustworthy statistical data economy social conditions russia required government business society informed decisions"
"P092429","project implementation undertaken federal statistics service russian federation rosstat main budget executor project"
"P092429","project interim unaudited financial reports ifrs project monitoring supervision"
"P092429","project level budget funds provided rosstat significantly simplifying flow funds"
"P092429","project management component support project implementation unit piu"
"P092429","rationale bank involvement"
"P092429","recently statistical master plan smp mediumterm federal targeted program ftp development statistics russia prepared"
"P092429","remaining costs approval"
"P092429","remote data collection purposes social economic statistics labor statistics household budget statistics health social security statistics"
"P092429","report ru project appraisal document proposed loan ln amount million russian federation statistical system development project statcap apl program june poverty reduction economic management sector unit russian federation country unit europe central asia region document restricted distribution recipients performance official duties"
"P092429","reporting monitoring"
"P092429","risk analysis"
"P092429","rosstat collects data federal ministries agencies"
"P092429","rosstat decided implement extension pilots"
"P092429","rosstat direct responsibility department determines strategy"
"P092429","rosstat supports development monitoring evaluation framework evaluate achievement investments realized technical assistance develop suite indicators standard statistical community"
"P092429","rosstat oversight authority regional statistical offices regions country"
"P092429","rosstat total responsibility collection primary secondary data regional offices primary data collection undertaken field staff statistical offices rayon regional level processed data transferred central office arrangements"
"P092429","rosstat federal executive body responsible coordination operational control statistical activities russia"
