"Project","Text"
"P088799","specific objectives system include tracking project objectives outputs inputs facilitate project implementation providing basis informed effective proj ectrelated decisionmaking promoting accountability resource objectives plans iiproviding receiving feedback stakeholders generating inputs dissemination project results lessons learned"
"P088799","specific training activities subcomponent indigenous communities planning participation diagnostic indigenous community development plans subcomponent"
"P088799","specifically proders improved governance framework designed carry institutional strengthening improvement management systems mitigate fiduciary risks enhance public accountability transparency means highly participatory approach improved access public information"
"P088799","specifically project provide seed capital technical assistance information overcome barriers adoption sustainable productive land practices promote adoption decentralized approach sustainable rural development focus local decisionmaking"
"P088799","specifically project support market studies capacity building extensionists provide skills assist farmers production diversification product processing marketing marketing organization"
"P088799","srdp annual audit"
"P088799","srdp expanded scope audit"
"P088799","stakeholder involvement"
"P088799","stakeholder participation"
"P088799","stakeholders include smallscale farmers local community organizations indigenous communities indigenous associations ias rural laborers rural school teachers students technical staff managers local governments main government agencies implementing projects related poverty reduction natural resources management sustainable rural development producer civil society associations staff magdeag relevant directorates"
"P088799","stakeholders play key role project implementation decisionmaking cdgs project steering committees"
"P088799","standards risk project additional annual report audit project financial concurrent audit opinion details statements"
"P088799","standards risk project additional supervision site visits times"
"P088799","steering committees stakeholder han"
"P088799","strategic context rationale"
"P088799","strategic fit project linkages bankgefjsdffinanced rural sector projects"
"P088799","strengthening mag financial administrative functions"
"P088799","strengthening senacsa health improvement sigor system improved coverage incorporating units reaching local units line information outcome information load average animal tracking registering delay days current figures information system load month registering delay information sigor improved livestock movements week covering current delay month livestock units registration range livestock covering compared current figures units laboratories facilities safety laboratory providing quality safety biotery beef safe pathogen agents sample processing vaccines chemical residues analysis analysis functioning biotery laboratory producing quality adequate efficiently field quantities biological inputs safety operations laboratory demanding laboratories"
"P088799","strengthening senacsa"
"P088799","strengthening vmg provision quality genetic material cattle sheep milk cows goats livestock units microcatchments smallscale farmers indigenous communities microcatchments trained animal health management genetics artificial insemination livestock pasture management improvement quality pasture availability microcatchments provision improved pastures seeds sow livestock unit promotion alternative enterprises poultry pig honey production smallscale farmers diversify risks"
"P088799","strengthening vmg"
"P088799","strengths weaknesses"
"P088799","studies research details studies timetable"
"P088799","studies research"
"P088799","study tours exchanges included improve understanding mainstreaming environmental microcatchment management"
"P088799","subproject grant applications prepared project beneficiaries support project extensionists microcatchments indigenous communities revised initially microcatchment development committees mdcs involving indigenous communities indigenous association ia"
"P088799","subproject grants finance maximum investments"
"P088799","subproject proposals developed based aforementioned plans screened selected grant financing projects sustainable rural development fund detail annex appendix"
"P088799","subproject proposals prepared eligible project beneficiaries support project extensionists"
"P088799","subprojects fis community development investment subdroiects cis indigenous community investment subdroiects municipal investment subprojects"
"P088799","subprojects proposals address issues related animal registration facilities sound management vaccination programs"
"P088799","subprojects reviewed approved endorsed pmu levels operational manual"
"P088799","subsequent qer review january sat team highlighted indigenous peoples safeguards mechanisms innovative practice"
"P088799","substandard housing overcrowding lack sanitation services polluted water supplies food insecurity widespread smallscale farmer indigenous community households"
"P088799","activities include periodic workshops project participants assess project implementation plan future actions quarterly semiannual evaluation meetings mscs"
"P088799","investments propose short medium longterm solutions collaborative land water management conservation activities time increasing soil fertility farm productivity income promote improvement animal health husbandry smallscale farmers indigenous communities"
"P088799","summary conclusion financial management assessment"
"P088799","supervision plan type timing mechanism bj ective visit integrating project review international organization times team supervision designated account reconciliation missions funds followup external audit recommendations raised issues"
"P088799","suplemento antropoldgico"
"P088799","support depend individual community determined assistance indigenous peoples land access natural resources index designed project team target relevant activities community"
"P088799","supporting documentation form statement expenditures soes initially exception payments related contracts soe threshold reimbursed supporting documentation"
"P088799","sustainabilitv outcomes"
"P088799","sustainability"
"P088799","table categories fdrs subprojects activities costs upper thresholds"
"P088799","table distribution microcatchments established level priority microcatchments total micro priority level municipalies assisted catchments assisted medium medium low total"
"P088799","table municipality priorities low medium low medium total department priority priority priority municipalities prioritv caarzuazu san pedro tmk"
"P088799","taking consideration grants financed life project facilitate adequate timely implementation monitoring grants current risk environment flow funds agreement signed mag eligible grant beneficiaries mag deliver beneficiary registry bnf ii eligible beneficiaries bank accounts bnf exclusively receive funds implementation community investment subprojects iiithe ris request advance payments mh deposit project account bnf iv beneficiaries meet requirements receive resources mag inform bnf transfer funds tranche project account beneficiary individual bank accounts beneficiaries payments suppliers services subprojects activities"
"P088799","taking consideration status indigenous communities indigenous communities project considered priority due incidence poverty level degradation natural resources depend survival"
"P088799","taking context account proposed project collaborate closely indi complete regularization indigenous lands"
"P088799","targeting criteria select priority departments"
"P088799","targeting criteria select priority microcatchmentswithin selected municipalities"
"P088799","targeting criteria select priority municipalities"
"P088799","targeting criteria select priority municipalities include socioeconomic environmental factors land"
"P088799","targeting criteria select microcatchmentsper municipality"
"P088799","targeting proiects activities larger eastern region paraguay"
"P088799","targets activities indigenous communities"
"P088799","technical assistance training cover techniques improve agricultural livestock production sustainable management natural resources product intensification diversification processing marketing environmental protection developing management skills organization extension system"
"P088799","technical strategy"
"P088799","technical sustainabilitv"
"P088799","technologies markets required crop diversification vegetables instances locally additional volumes market marginal"
"P088799","ten departments paraguay covered project"
"P088799","ten percent rural population owns twothirds land percent population landless"
"P088799","provide detailed accounting procedures type transactions"
"P088799","notwithstanding scores obtained pillar employment amended local law methods low procurement threshold methodology assessment national procurement svstems version published july auspices joint world bank oecd development assistance committee dac procurement round table initiative"
"P088799","achc language ethnic nomadic hunters gatherers suffered major persecution population survived farmers"
"P088799","ache avoided contact national society lived nomadic life scattered"
"P088799","ache pejoratively called guajaki paraguayan population persecuted paraguays independence"
"P088799","achievement projects principal outcomes assessed key performance indicators annex details cdgs mdcs mscs ias established strengthened participating management rural sustainable development target micro catchments indigenous communities project participation women rural youth decisionmaking level participation agreed organizations measured established trained submitting subproject proposals target farms increase agricultural incomes"
"P088799","administrative operational manual define fm fdrs staff strength processes functions subject bank fm review negotiations"
"P088799","aim minimize association indigenous peoples caazaph jekaha yma pave association leaders yacy caay district association avb guarani indigenous communities alto canindeju zone association indigenous communities san pedro acispe association guarani communities alto paranh"
"P088799","allocation financial resources proders estimated million partially represent counterpart contribution government paraguay"
"P088799","analysis expected benefits farm level improved practices yield returns hectare traditional annex"
"P088799","annual project budget submitted ministry approval"
"P088799","approach adopted improved governance framework"
"P088799","approaches developed projects reviewed discussed adapted information exchange seminars bank eminently positioned facilitate including developing innovative investment scale proposals assistance projects rural development fund kfws sustainable management natural resources project objective introduce sustainable agricultural forestry management systems scale farms sharing bestpractices conservation agriculture notillage ifads paraguay rural project sharing experiences creation social capital training beneficiaries organizations collective commercialization agricultural products gtzexecuted caazapa rural development project focused sustainable management natural resources diversification production improvement local regional public management sharing experiences product diversification idbs modernization agricultural public management project followup operation recently closed program support development cotton farms prodesal sharing information promoting coordination bestpractices technologies smallholder sector"
"P088799","approval bank project operational manual condition loan negotiations selection individual consultants assistance human resources firm hired project endeavor"
"P088799","assets procured project incorporated project recorded asset registry"
"P088799","atlantic forest upper parana atlantic forest endangered biomes globally biodiversity holds highly threatened"
"P088799","ava called chiripa ava katuete true ethnographic literature"
"P088799","ava guarani"
"P088799","bank supported microcatchment areabased sustainable rural development projects brazilian santa catarina paranh rio grande sul sfio paul proving effective"
"P088799","bank countries latin american region world manage incidence food mouth transboundary diseases"
"P088799","bank team formulated improved governance supervision approach entail intensive usual supervision bank"
"P088799","bank finance maximum million eligible expenditures proposed project incurred january signing"
"P088799","banks comparative advantage lies unique experiences multilateral donor executing projects similar focus specifically locallevel capacity building planning natural resource management"
"P088799","banks country portfolio review october identified main issues affecting portfolio implementation paraguay"
"P088799","basis social organization guarani mbya pai tavytera ava guarani extended family headed male elder"
"P088799","beneficiary perception project performance monitored closely events encouraged project deag extension agents"
"P088799","beneficiary perception project performance monitored closely events encouraged project extensionists"
"P088799","borrower appraisal developed procurement plan project implementation basis procurement methods initial procurement plan"
"P088799","budget process acceptable bank"
"P088799","default approach notwithstanding identify opportunities benefiting employment local law procurement procedures procurement portal sicp sistema de informacidn de contrataciones pziblicas gain additional transparency competitiveness information systems local level"
"P088799","cas paraguay renowned corruption contraband"
"P088799","central headed project manager responsibility technical administrative management project including coordination partner institutions indi indert seam"
"P088799","combined total criteria established maximum score"
"P088799","commission developed program institutional reforms period public consultation actively promoting adoption reforms"
"P088799","communities rankings index access projects activities determined communitys indigenous community development plan"
"P088799","communities rankings access projects activities determined communitys indigenous community development plan"
"P088799","component project provide technical assistance advice administration finance mag annex"
"P088799","component benefit rural workers extensionists artisans utilize natural resources"
"P088799","comprehensive fiduciary framework includes series financial management measures including ifm capacity building mag iienhanced fm arrangements iiibank compliant reporting system control framework linking disbursements service output final beneficiary iv concurrent audit mechanisms fund transfers final beneficiaries enhanced fm supervision fiduciary measures vi coordination integrated fiduciary assessments linkages upcoming paraguay fiduciary action plan vii bank fiduciary staff advice mag"
"P088799","concept territoriality guarani indians closely linked tekoha guaszi physical geographic sociopolitical religious economic connotations"
"P088799","conclusion pillars iirequire improvement pillars iii iv require substantial improvement"
"P088799","concurrent audit provide opinion fdrs financial statements reports"
"P088799","consultations revealed strong indigenous leaders actively participating project implementation assembled beneficiary communities principal demands incorporated project design"
"P088799","contemporary guarani economy characterized fundamental systems isubsistence swidden horticulture average size plots half hectare iihunting fishing undertaken exclusively iii gathering forest resources ranging yerba mate medicinal plants fibers handicraft iv sources cash income include paid labor temporary sale handicrafts"
"P088799","content duration training sessions courses information events adjusted types audiences smallscale farmers indigenous communities local departmental governments ngos"
"P088799","contracting concurrent auditor condition disbursement expenditure category community grants"
"P088799","conversion profitable sustainable system involve gradual process aimed reaching productive rehabilitation sustainable diversified production path farmers complete project period"
"P088799","corrective measures agreed resorting extent traditional procurement methods includes employment country procurement portal sicp sistema de informacidn de contrataciones pziblicas employment sepa sistema de ejecucidn de planes de adquisiciones project activities inclusion loan agreement special procurement provisions listed section covenants listed section implementation oversight mechanism subprojects concurrent audit hiring human resources firm select individual consultants hiring project procurement specialist assistants"
"P088799","cost stream economic analysis based elements ionfarm extension farmers iii investment recurrent costs ii community development costs training iv community municipality investments partial costs project administration"
"P088799","country rate population growth rural south america"
"P088799","country risks defined cas summarized iexistence corruption ii weak basic governmental management systems iii special pressure persuade government accommodate iv decline rule law"
"P088799","country constraints controlling animal health result inadequate infrastructure regulatory agency network clinics laboratories"
"P088799","coverage sanitation networks weak institutional framework"
"P088799","criteria determine kinds benefits community receives transparent widely disseminated"
"P088799","crop pattern dominated food crops cash crops cotton"
"P088799","current forest cover eastern region approximately hectares hectares correspond productive forests"
"P088799","current indigenous population representing countrys total illiteracy rate latin america"
"P088799","current fm staff arrangements strengthened"
"P088799","current population ethnic totals"
"P088799","current status indigenous territories reduced makes impossible carry traditional practices hunting fishing gathering enjoy natural wealth biodiversity"
"P088799","degradation soil forest resources caused unsustainable land exacerbated inadequate planning productive endeavors national local levels access credit"
"P088799","degradation soil forest resources caused unsustainable land exacerbated inadequate planning productive endeavors national local levels weak enforcement environmental laws weak generation adaptation transfer applied technology"
"P088799","destruction ecosystem surrounding communities results extreme nutritional guarani families directly influences physical deterioration consequences endemic diseases"
"P088799","detailed risk analysis provided annex"
"P088799","diagnostic performed project preparation existence total microcatchments municipalities"
"P088799","farm models tend representative departments"
"P088799","director dincap uaf reporting directly"
"P088799","draft ea respective submitted bank december"
"P088799","draft ea respective emp submitted borrower december"
"P088799","procedures"
"P088799","earlier projects pilot credit component canceled midterm review"
"P088799","eastern region traditional territory indigenous population distributed ethnic belonging tupiguarani linguistic family"
"P088799","eastern region comprised departments selected basis national poverty index represent proposed project annex map project"
"P088799","eastern region possesses forest ecosystems rich biodiversity represented varied extensive plant communities appreciated world"
"P088799","economic turnaround led significant decline external public debt stood gdp earlier"
"P088799","economist intelligence unit uk"
"P088799","efficiency public expenditure depends highly governance environment practices"
"P088799","entire participation strategy pursued project based social assessment indigenous peoples strategy annexes designed permanent feedback process project staff beneficiary population"
"P088799","ethnic chaco reside eastern region toba maskoy rural workers"
"P088799","evaluation focus effectiveness achieving project results meeting implementation schedule identifying components adjustments emphasizing lessons learned guide actions projects final phase expost evaluation independent external evaluation carried project focusing questions indicators midterm evaluation"
"P088799","executive structure project accompanied zone coordination units zcu"
"P088799","existing distribution land paraguay grossly unequal inequitable latin america"
"P088799","expanded agricultural activities create onfarm employment opportunities equivalent manyears annually py"
"P088799","expansion modern agriculture left poor smallscale farmers continue subsistence farming supplementedby cotton production"
"P088799","expected principal outcomes primary target smallscale farmers indigenous communities capacity active participation planning implementation sustainable agriculture rural development activities farm community microcatchment levels ii increased local management capacity support implementation iiiimproved incomes living conditions food security management environmental resources"
"P088799","extension network operate zcus established cda extensionist microcatchment specialized extensionists indigenous communities extensionists total"
"P088799","extension system paraguay weak limited operational budgetary allocations staff complement half retirement inadequate supporting infrastructure"
"P088799","farming systems target population characterized productivity sustainable land management practices leading soil erosion loss nutrients chemical organic fertilizers chemical pest control manual mechanical weeding absence onfarm investments land improvements"
"P088799","fdrs reporting incorporated project financial statements financial monitoring reports"
"P088799","fdrs represents significant proportion total loan amount million total loan amount"
"P088799","fdrs administered procedures financial arrangements components project"
"P088799","fdrs characterized decentralized project review process facilitate rapid response assistance requests maintain closer contact potential participants"
"P088799","field carried zone coordination units zcu annex include social organization technicians extensionist microcatchments"
"P088799","filing system developed senacsa model counting loan effectiveness project create web page disseminate significant project information"
"P088799","final ea infoshop appraisal"
"P088799","final ea infoshop appraisal"
"P088799","final evaluation aim identify project impacts sustainability project results degree achievement longterm results internal external auditing project subject internal auditing mags internal auditing directorate"
"P088799","final reports analyzed evaluated technical committee results disseminated adoption farmers"
"P088799","financial internal rate return considered relevant assessing projects expected financial impact investments technical assistance services provided beneficiaries grants model results reflect actual market cost benefit"
"P088799","financial management arrangements proiect srdp meet bank requirements"
"P088799","financial management fm arrangements project srdp meet bank requirements"
"P088799","financial viability production investment models amply validated parn project"
"P088799","ethnic mentioned speak distinct languages belong tupi guarani linguistic family"
"P088799","pillar fiscal financial stabilization sine qua regaining confidence economy sustainable growth path"
"P088799","subcomponent project management capacity building mag finances management services office equipment administrative operational expenditures improve mags organizational skillsmix effectively manage project"
"P088799","subcomponent rural extension supports beneficiaries prepare micro catchment development plans mdp indigenous community development plans icdp municipal investment plans mip participatory identification community demands social technical financial support arising plans implementation community level training indigenous community microcatchmentlevel community promoters facilitate process knowledge management adopting project strategy respective community levels"
"P088799","subcomponent strengthening senacsa finances software information systems lab office equipment communication services consulting training improve performance senacsa implement effective animal health strategy paraguay"
"P088799","subcomponent training includes activities build awareness capacity relating project strategy approach project technical staff including extension agents extension agents indigenous communities social organization technicians smallscale farmers indigenous communities"
"P088799","proposals plans type additionally priorreviewed bank"
"P088799","fm arrangements designed mitigate fiduciary risk generated management funds poorly capacitated communities weak control environment"
"P088799","chart previous project audit opinion auditors previous"
"P088799","dissemination media employed project ihome page project news technical information results attained ii printed periodic reports project annual reports project news projecttargeted departments municipalities microcatchments iiinews media print radio television iv promotional campaigns transmitted radio educational programs videotape shown localhegional television meetings courses vi printed material distribution target microcatchments booklets folders reports vii media determined project including audiovisual"
